ID,title,organiser,blurb,description,guid,activity_or_event,url,is_free,price_display_teaser,price_display,price,min_price,max_price,age_group_display,min_age,max_age,datetime_display_teaser,datetime_display,start_datetime,end_datetime,venue_name,address_display,categories,images,images_replace_quotes,longitude,latitude,checked,_source_url,region,planning_area,Label tagging,Keyword tagging
101,Yishun River Green Playground and Outdoor Gym Area,Playpoint,Outdoor fun at Yishun River Green residences.,"Yishun River Green features a vibrant playground and outdoor gym area designed for residents of all ages. The playground offers a safe and engaging space for children to play and develop their motor skills, while the outdoor gym provides adults with a convenient way to stay active and maintain a healthy lifestyle. The area is well-maintained and provides a great opportunity for families to spend quality time together outdoors. The playground includes swings, slides, and climbing structures, ensuring there's something for every child to enjoy. The outdoor gym is equipped with various exercise machines, allowing residents to work on their strength and endurance. The space is designed to promote community interaction and a healthy lifestyle.",https://playpoint.asia/projects/public-residences/?filter-country=singapore,activity,https://playpoint.asia/projects/public-residences/?filter-country=singapore,TRUE,Free,Free,0,0,0,1 to 12 years old,0,12,Available daily,Available daily,1970-01-01T00:00:00+08:00,2099-12-31T23:59:59+08:00,Yishun River Green,"329 Yishun Ring Rd, Singapore 760329",Outdoor Playground,"[{""local_path"": ""events_output/event_60/images/user_uploads/Yishun_River_Green_Playground_and_Outdoor_Gym_Area_1.jpg"", ""filename"": ""Yishun_River_Green_Playground_and_Outdoor_Gym_Area_1.jpg"", ""original_url"": ""https://playpoint.asia/projects/public-residences/yishun-river-green/"", ""source_credit"": ""playpoint""}, {""local_path"": ""events_output/event_60/images/user_uploads/Yishun_River_Green_Playground_and_Outdoor_Gym_Area_2.jpg"", ""filename"": ""Yishun_River_Green_Playground_and_Outdoor_Gym_Area_2.jpg"", ""original_url"": ""https://playpoint.asia/projects/public-residences/yishun-river-green/"", ""source_credit"": ""playpoint""}, {""local_path"": ""events_output/event_60/images/user_uploads/Yishun_River_Green_Playground_and_Outdoor_Gym_Area_3.jpg"", ""filename"": ""Yishun_River_Green_Playground_and_Outdoor_Gym_Area_3.jpg"", ""original_url"": ""https://playpoint.asia/projects/public-residences/yishun-river-green/"", ""source_credit"": ""playpoint""}, {""local_path"": ""events_output/event_60/images/user_uploads/Yishun_River_Green_Playground_and_Outdoor_Gym_Area_4.jpg"", ""filename"": ""Yishun_River_Green_Playground_and_Outdoor_Gym_Area_4.jpg"", ""original_url"": ""https://playpoint.asia/projects/public-residences/yishun-river-green/"", ""source_credit"": ""playpoint""}]","[{""local_path"": ""events_output/event_60/images/user_uploads/Yishun_River_Green_Playground_and_Outdoor_Gym_Area_1.jpg"", ""filename"": ""Yishun_River_Green_Playground_and_Outdoor_Gym_Area_1.jpg"", ""original_url"": ""https://playpoint.asia/projects/public-residences/yishun-river-green/"", ""source_credit"": ""playpoint""}, {""local_path"": ""events_output/event_60/images/user_uploads/Yishun_River_Green_Playground_and_Outdoor_Gym_Area_2.jpg"", ""filename"": ""Yishun_River_Green_Playground_and_Outdoor_Gym_Area_2.jpg"", ""original_url"": ""https://playpoint.asia/projects/public-residences/yishun-river-green/"", ""source_credit"": ""playpoint""}, {""local_path"": ""events_output/event_60/images/user_uploads/Yishun_River_Green_Playground_and_Outdoor_Gym_Area_3.jpg"", ""filename"": ""Yishun_River_Green_Playground_and_Outdoor_Gym_Area_3.jpg"", ""original_url"": ""https://playpoint.asia/projects/public-residences/yishun-river-green/"", ""source_credit"": ""playpoint""}, {""local_path"": ""events_output/event_60/images/user_uploads/Yishun_River_Green_Playground_and_Outdoor_Gym_Area_4.jpg"", ""filename"": ""Yishun_River_Green_Playground_and_Outdoor_Gym_Area_4.jpg"", ""original_url"": ""https://playpoint.asia/projects/public-residences/yishun-river-green/"", ""source_credit"": ""playpoint""}]",103.8422963,1.4313102,TRUE,,North Region,Yishun,,"Slide, neighborhood, neighbourhood"
102,Yishun Riverwalk Playground and Outdoor Space,Playpoint,Explore the Yishun Riverwalk playground.,"Yishun Riverwalk features a vibrant and engaging playground designed for children of various ages. The playground includes climbing structures, slides, and interactive play elements that promote physical activity and imaginative play. The surrounding outdoor space offers seating areas and walking paths, making it a perfect spot for families to relax and enjoy the natural environment. The playground is designed with safety in mind, featuring soft surfaces and age-appropriate equipment. It's a great place for kids to burn off energy and for parents to connect with their children in a fun and active setting. The area is well-maintained and provides a welcoming atmosphere for the community.",https://playpoint.asia/projects/public-residences/?filter-country=singapore,activity,https://playpoint.asia/projects/public-residences/?filter-country=singapore,TRUE,Free,Free,0,0,0,1 to 12 years old,0,12,Available daily,Available daily,1970-01-01T00:00:00+08:00,2099-12-31T23:59:59+08:00,Yishun Riverwalk,"Block 334D, Yishun Street 31, Singapore 760334",Outdoor Playground,"[{""local_path"": ""events_output/event_61/images/user_uploads/Yishun_Riverwalk_Playground_and_Outdoor_Space_1.jpg"", ""filename"": ""Yishun_Riverwalk_Playground_and_Outdoor_Space_1.jpg"", ""original_url"": ""https://playpoint.asia/projects/public-residences/yishun-riverwalk/"", ""source_credit"": ""playpoint""}, {""local_path"": ""events_output/event_61/images/user_uploads/Yishun_Riverwalk_Playground_and_Outdoor_Space_2.jpg"", ""filename"": ""Yishun_Riverwalk_Playground_and_Outdoor_Space_2.jpg"", ""original_url"": ""https://playpoint.asia/projects/public-residences/yishun-riverwalk/"", ""source_credit"": ""playpoint""}, {""local_path"": ""events_output/event_61/images/user_uploads/Yishun_Riverwalk_Playground_and_Outdoor_Space_3.jpg"", ""filename"": ""Yishun_Riverwalk_Playground_and_Outdoor_Space_3.jpg"", ""original_url"": ""https://playpoint.asia/projects/public-residences/yishun-riverwalk/"", ""source_credit"": ""playpoint""}, {""url"": ""https://playpoint.asia/wp-content/uploads/ywk_060-feature.jpg"", ""source_credit"": ""Playpoint""}]","[{""local_path"": ""events_output/event_61/images/user_uploads/Yishun_Riverwalk_Playground_and_Outdoor_Space_1.jpg"", ""filename"": ""Yishun_Riverwalk_Playground_and_Outdoor_Space_1.jpg"", ""original_url"": ""https://playpoint.asia/projects/public-residences/yishun-riverwalk/"", ""source_credit"": ""playpoint""}, {""local_path"": ""events_output/event_61/images/user_uploads/Yishun_Riverwalk_Playground_and_Outdoor_Space_2.jpg"", ""filename"": ""Yishun_Riverwalk_Playground_and_Outdoor_Space_2.jpg"", ""original_url"": ""https://playpoint.asia/projects/public-residences/yishun-riverwalk/"", ""source_credit"": ""playpoint""}, {""local_path"": ""events_output/event_61/images/user_uploads/Yishun_Riverwalk_Playground_and_Outdoor_Space_3.jpg"", ""filename"": ""Yishun_Riverwalk_Playground_and_Outdoor_Space_3.jpg"", ""original_url"": ""https://playpoint.asia/projects/public-residences/yishun-riverwalk/"", ""source_credit"": ""playpoint""}, {""url"": ""https://playpoint.asia/wp-content/uploads/ywk_060-feature.jpg"", ""source_credit"": ""Playpoint""}]",103.84607,1.43309,TRUE,,North Region,Yishun,,"Slide, neighborhood, neighbourhood"
103,Pin Yi Greens Playground and Recreational Space,Playpoint Asia,Outdoor recreational space for families and children.,"Pin Yi Greens offers a vibrant outdoor space designed for families and children. The playground features modern play equipment suitable for various age groups, promoting physical activity and social interaction. The recreational area includes open spaces for relaxation and community events, fostering a sense of community. With lush greenery and thoughtful landscaping, Pin Yi Greens provides a safe and engaging environment for kids to play and families to enjoy quality time together. It's a perfect spot for outdoor fun and recreation, encouraging a healthy and active lifestyle for all residents. The playground is designed to be inclusive and accessible, ensuring that children of all abilities can participate and have fun. The space also includes seating areas for parents and caregivers to relax while supervising their children.",https://playpoint.asia/projects/public-residences/?filter-country=singapore,activity,https://playpoint.asia/projects/public-residences/?filter-country=singapore,TRUE,Free,Free,0,0,0,1 to 12 years old,0,12,Available daily,Available daily,1970-01-01T00:00:00+08:00,2099-12-31T23:59:59+08:00,Pin Yi Greens,"807A Chai Chee Rd, Singapore 461807",Outdoor Playground,"[{""local_path"": ""events_output/event_62/images/user_uploads/Pin_Yi_Greens_Playground_and_Recreational_Space_1.jpg"", ""filename"": ""Pin_Yi_Greens_Playground_and_Recreational_Space_1.jpg"", ""original_url"": ""https://playpoint.asia/projects/public-residences/pin-yi-greens/"", ""source_credit"": ""playpoint""}, {""url"": ""https://playpoint.asia/wp-content/uploads/808cc_096-feature.jpg"", ""source_credit"": ""Playpoint Asia""}]","[{""local_path"": ""events_output/event_62/images/user_uploads/Pin_Yi_Greens_Playground_and_Recreational_Space_1.jpg"", ""filename"": ""Pin_Yi_Greens_Playground_and_Recreational_Space_1.jpg"", ""original_url"": ""https://playpoint.asia/projects/public-residences/pin-yi-greens/"", ""source_credit"": ""playpoint""}, {""url"": ""https://playpoint.asia/wp-content/uploads/808cc_096-feature.jpg"", ""source_credit"": ""Playpoint Asia""}]",103.9233317,1.3276198,TRUE,,East Region,Bedok,,"Slide, neighborhood, neighbourhood"
104,Bishan NRP Playground for Community Engagement,Playpoint,"Engaging community playground in Bishan, Singapore.","The Bishan NRP playground is designed to foster community engagement through play. It features modern play equipment suitable for children of various ages, encouraging physical activity and social interaction. The playground includes climbing structures, slides, and interactive play panels, creating a safe and stimulating environment for kids to explore and develop their motor skills. The design incorporates inclusive elements to ensure accessibility for children of all abilities. The playground serves as a vibrant hub for families and residents to connect and enjoy outdoor recreation.",https://playpoint.asia/projects/public-residences/?filter-country=singapore,activity,https://playpoint.asia/projects/public-residences/?filter-country=singapore,TRUE,Free,Free,0,0,0,1 to 12 years old,0,12,Available daily,Available daily,1970-01-01T00:00:00+08:00,2099-12-31T23:59:59+08:00,Bishan NRP,"Bishan St. 23, Singapura 570231",Outdoor Playground,"[{""local_path"": ""events_output/event_63/images/user_uploads/Bishan_NRP_Playground_for_Community_Engagement_1.jpg"", ""filename"": ""Bishan_NRP_Playground_for_Community_Engagement_1.jpg"", ""original_url"": ""https://playpoint.asia/projects/public-residences/bishan-nrp/"", ""source_credit"": ""playpoint""}, {""local_path"": ""events_output/event_63/images/user_uploads/Bishan_NRP_Playground_for_Community_Engagement_2.jpg"", ""filename"": ""Bishan_NRP_Playground_for_Community_Engagement_2.jpg"", ""original_url"": ""https://playpoint.asia/projects/public-residences/bishan-nrp/"", ""source_credit"": ""playpoint""}, {""local_path"": ""events_output/event_63/images/user_uploads/Bishan_NRP_Playground_for_Community_Engagement_3.jpg"", ""filename"": ""Bishan_NRP_Playground_for_Community_Engagement_3.jpg"", ""original_url"": ""https://playpoint.asia/projects/public-residences/bishan-nrp/"", ""source_credit"": ""playpoint""}, {""local_path"": ""events_output/event_63/images/user_uploads/Bishan_NRP_Playground_for_Community_Engagement_4.jpg"", ""filename"": ""Bishan_NRP_Playground_for_Community_Engagement_4.jpg"", ""original_url"": ""https://playpoint.asia/projects/public-residences/bishan-nrp/"", ""source_credit"": ""playpoint""}, {""local_path"": ""events_output/event_63/images/user_uploads/Bishan_NRP_Playground_for_Community_Engagement_5.jpg"", ""filename"": ""Bishan_NRP_Playground_for_Community_Engagement_5.jpg"", ""original_url"": ""https://playpoint.asia/projects/public-residences/bishan-nrp/"", ""source_credit"": ""playpoint""}, {""url"": ""https://playpoint.asia/wp-content/uploads/cover-2.jpg"", ""source_credit"": ""Playpoint""}]","[{""local_path"": ""events_output/event_63/images/user_uploads/Bishan_NRP_Playground_for_Community_Engagement_1.jpg"", ""filename"": ""Bishan_NRP_Playground_for_Community_Engagement_1.jpg"", ""original_url"": ""https://playpoint.asia/projects/public-residences/bishan-nrp/"", ""source_credit"": ""playpoint""}, {""local_path"": ""events_output/event_63/images/user_uploads/Bishan_NRP_Playground_for_Community_Engagement_2.jpg"", ""filename"": ""Bishan_NRP_Playground_for_Community_Engagement_2.jpg"", ""original_url"": ""https://playpoint.asia/projects/public-residences/bishan-nrp/"", ""source_credit"": ""playpoint""}, {""local_path"": ""events_output/event_63/images/user_uploads/Bishan_NRP_Playground_for_Community_Engagement_3.jpg"", ""filename"": ""Bishan_NRP_Playground_for_Community_Engagement_3.jpg"", ""original_url"": ""https://playpoint.asia/projects/public-residences/bishan-nrp/"", ""source_credit"": ""playpoint""}, {""local_path"": ""events_output/event_63/images/user_uploads/Bishan_NRP_Playground_for_Community_Engagement_4.jpg"", ""filename"": ""Bishan_NRP_Playground_for_Community_Engagement_4.jpg"", ""original_url"": ""https://playpoint.asia/projects/public-residences/bishan-nrp/"", ""source_credit"": ""playpoint""}, {""local_path"": ""events_output/event_63/images/user_uploads/Bishan_NRP_Playground_for_Community_Engagement_5.jpg"", ""filename"": ""Bishan_NRP_Playground_for_Community_Engagement_5.jpg"", ""original_url"": ""https://playpoint.asia/projects/public-residences/bishan-nrp/"", ""source_credit"": ""playpoint""}, {""url"": ""https://playpoint.asia/wp-content/uploads/cover-2.jpg"", ""source_credit"": ""Playpoint""}]",103.8470378,1.3566757,TRUE,,Central Region,Bishan,,"Slide, neighborhood, neighbourhood"
105,West Coast Park Playground for Outdoor Fun,SEMEC,Enjoy a public playground with SEMEC equipment.,"West Coast Park offers a public playground equipped with innovative play structures. This outdoor space provides children with a safe and engaging environment to explore, climb, and develop their physical skills. The playground features a variety of equipment designed to stimulate creativity and promote social interaction among kids of all ages. Families can enjoy a day out in nature while children have fun on the playground. It's a great place for kids to burn off energy and make new friends in a secure and well-maintained setting.",https://www.semec.com.sg/parks,activity,https://www.semec.com.sg/parks,TRUE,Free,Free,0,0,0,1 to 12 years old,0,12,Available daily,Available daily,1970-01-01T00:00:00+08:00,2099-12-31T23:59:59+08:00,West Coast Park,"71 W Coast Hwy, Singapore 126844",Outdoor Playground,"[{""local_path"": ""events_output/event_1/images/user_uploads/West_Coast_Park_Playground_for_Outdoor_Fun_1.jpg"", ""filename"": ""West_Coast_Park_Playground_for_Outdoor_Fun_1.jpg"", ""original_url"": ""https://www.semec.com.sg/west-coast-park"", ""source_credit"": ""semec""}, {""local_path"": ""events_output/event_1/images/user_uploads/West_Coast_Park_Playground_for_Outdoor_Fun_2.jpg"", ""filename"": ""West_Coast_Park_Playground_for_Outdoor_Fun_2.jpg"", ""original_url"": ""https://www.semec.com.sg/west-coast-park"", ""source_credit"": ""semec""}, {""url"": ""https://static.wixstatic.com/media/a8e125_b69722294359492884ba136e3de9494d~mv2_d_4608_2592_s_4_2.jpg/v1/fill/w_474,h_300,al_c,q_80,usm_0.66_1.00_0.01,enc_avif,quality_auto/a8e125_b69722294359492884ba136e3de9494d~mv2_d_4608_2592_s_4_2.jpg"", ""source_credit"": ""SEMEC""}, {""url"": ""https://static.wixstatic.com/media/a8e125_2f1fbd104eae4f389de26608cd0e49bb~mv2_d_4608_2592_s_4_2.jpg/v1/fill/w_474,h_300,al_c,q_80,usm_0.66_1.00_0.01,enc_avif,quality_auto/a8e125_2f1fbd104eae4f389de26608cd0e49bb~mv2_d_4608_2592_s_4_2.jpg"", ""source_credit"": ""SEMEC""}, {""url"": ""https://static.wixstatic.com/media/a8e125_9a6cbfbe902442188d5d2bf823d78866~mv2_d_4608_2592_s_4_2.jpg/v1/fill/w_474,h_301,al_c,q_80,usm_0.66_1.00_0.01,enc_avif,quality_auto/a8e125_9a6cbfbe902442188d5d2bf823d78866~mv2_d_4608_2592_s_4_2.jpg"", ""source_credit"": ""SEMEC""}, {""url"": ""https://static.wixstatic.com/media/a8e125_7ea95dab18444939a8fd3d071cc07655~mv2_d_4608_2592_s_4_2.jpg/v1/fill/w_476,h_301,al_c,q_80,usm_0.66_1.00_0.01,enc_avif,quality_auto/a8e125_7ea95dab18444939a8fd3d071cc07655~mv2_d_4608_2592_s_4_2.jpg"", ""source_credit"": ""SEMEC""}]","[{""local_path"": ""events_output/event_1/images/user_uploads/West_Coast_Park_Playground_for_Outdoor_Fun_1.jpg"", ""filename"": ""West_Coast_Park_Playground_for_Outdoor_Fun_1.jpg"", ""original_url"": ""https://www.semec.com.sg/west-coast-park"", ""source_credit"": ""semec""}, {""local_path"": ""events_output/event_1/images/user_uploads/West_Coast_Park_Playground_for_Outdoor_Fun_2.jpg"", ""filename"": ""West_Coast_Park_Playground_for_Outdoor_Fun_2.jpg"", ""original_url"": ""https://www.semec.com.sg/west-coast-park"", ""source_credit"": ""semec""}, {""url"": ""https://static.wixstatic.com/media/a8e125_b69722294359492884ba136e3de9494d~mv2_d_4608_2592_s_4_2.jpg/v1/fill/w_474,h_300,al_c,q_80,usm_0.66_1.00_0.01,enc_avif,quality_auto/a8e125_b69722294359492884ba136e3de9494d~mv2_d_4608_2592_s_4_2.jpg"", ""source_credit"": ""SEMEC""}, {""url"": ""https://static.wixstatic.com/media/a8e125_2f1fbd104eae4f389de26608cd0e49bb~mv2_d_4608_2592_s_4_2.jpg/v1/fill/w_474,h_300,al_c,q_80,usm_0.66_1.00_0.01,enc_avif,quality_auto/a8e125_2f1fbd104eae4f389de26608cd0e49bb~mv2_d_4608_2592_s_4_2.jpg"", ""source_credit"": ""SEMEC""}, {""url"": ""https://static.wixstatic.com/media/a8e125_9a6cbfbe902442188d5d2bf823d78866~mv2_d_4608_2592_s_4_2.jpg/v1/fill/w_474,h_301,al_c,q_80,usm_0.66_1.00_0.01,enc_avif,quality_auto/a8e125_9a6cbfbe902442188d5d2bf823d78866~mv2_d_4608_2592_s_4_2.jpg"", ""source_credit"": ""SEMEC""}, {""url"": ""https://static.wixstatic.com/media/a8e125_7ea95dab18444939a8fd3d071cc07655~mv2_d_4608_2592_s_4_2.jpg/v1/fill/w_476,h_301,al_c,q_80,usm_0.66_1.00_0.01,enc_avif,quality_auto/a8e125_7ea95dab18444939a8fd3d071cc07655~mv2_d_4608_2592_s_4_2.jpg"", ""source_credit"": ""SEMEC""}]",103.7623852,1.2970925,TRUE,https://www.semec.com.sg/west-coast-park,Central Region,Queenstown,Sandpit,"Slide, park, sand, swing, baby, toddler, ship"
106,Ang Mo Kio Park - An Outdoor Playground Experience,SEMEC,Public playground with SEMEC equipment for kids.,"Amk Park offers a public playground experience featuring SEMEC equipment, designed for children to engage in active and imaginative play. The playground provides a safe and stimulating environment where kids can develop their physical and social skills. With a variety of play structures and open spaces, Amk Park is an ideal destination for families seeking outdoor recreational activities. The park aims to promote healthy lifestyles and create memorable experiences for children of all ages. It's a great place for families to spend quality time together.",https://www.semec.com.sg/parks,activity,https://www.semec.com.sg/parks,TRUE,Free,Free,0,0,0,1 to 12 years old,0,12,Available daily,Available daily,1970-01-01T00:00:00+08:00,2099-12-31T23:59:59+08:00,Amk Park,"310B Ang Mo Kio Ave 1, Singapore 562310",Outdoor Playground,"[{""local_path"": ""events_output/event_2/images/user_uploads/Ang_Mo_Kio_Park___An_Outdoor_Playground_Experience_1.jpg"", ""filename"": ""Ang_Mo_Kio_Park___An_Outdoor_Playground_Experience_1.jpg"", ""original_url"": ""https://www.semec.com.sg/amk-park"", ""source_credit"": ""semec""}, {""local_path"": ""events_output/event_2/images/user_uploads/Ang_Mo_Kio_Park___An_Outdoor_Playground_Experience_2.jpg"", ""filename"": ""Ang_Mo_Kio_Park___An_Outdoor_Playground_Experience_2.jpg"", ""original_url"": ""https://www.semec.com.sg/amk-park"", ""source_credit"": ""semec""}, {""local_path"": ""events_output/event_2/images/user_uploads/Ang_Mo_Kio_Park___An_Outdoor_Playground_Experience_3.jpg"", ""filename"": ""Ang_Mo_Kio_Park___An_Outdoor_Playground_Experience_3.jpg"", ""original_url"": ""https://www.semec.com.sg/amk-park"", ""source_credit"": ""semec""}, {""local_path"": ""events_output/event_2/images/user_uploads/Ang_Mo_Kio_Park___An_Outdoor_Playground_Experience_4.jpg"", ""filename"": ""Ang_Mo_Kio_Park___An_Outdoor_Playground_Experience_4.jpg"", ""original_url"": ""https://www.semec.com.sg/amk-park"", ""source_credit"": ""semec""}, {""url"": ""https://static.wixstatic.com/media/a8e125_7e13d50edfdeb76711b74ed3cd5cc4cd.jpg/v1/fill/w_477,h_406,al_c,q_80,usm_0.66_1.00_0.01,enc_avif,quality_auto/a8e125_7e13d50edfdeb76711b74ed3cd5cc4cd.jpg"", ""source_credit"": ""SEMEC""}, {""url"": ""https://static.wixstatic.com/media/a8e125_67a98a04ed7549edb0dbdc1574e94994.jpg/v1/fill/w_473,h_406,al_c,q_80,usm_0.66_1.00_0.01,enc_avif,quality_auto/a8e125_67a98a04ed7549edb0dbdc1574e94994.jpg"", ""source_credit"": ""SEMEC""}]","[{""local_path"": ""events_output/event_2/images/user_uploads/Ang_Mo_Kio_Park___An_Outdoor_Playground_Experience_1.jpg"", ""filename"": ""Ang_Mo_Kio_Park___An_Outdoor_Playground_Experience_1.jpg"", ""original_url"": ""https://www.semec.com.sg/amk-park"", ""source_credit"": ""semec""}, {""local_path"": ""events_output/event_2/images/user_uploads/Ang_Mo_Kio_Park___An_Outdoor_Playground_Experience_2.jpg"", ""filename"": ""Ang_Mo_Kio_Park___An_Outdoor_Playground_Experience_2.jpg"", ""original_url"": ""https://www.semec.com.sg/amk-park"", ""source_credit"": ""semec""}, {""local_path"": ""events_output/event_2/images/user_uploads/Ang_Mo_Kio_Park___An_Outdoor_Playground_Experience_3.jpg"", ""filename"": ""Ang_Mo_Kio_Park___An_Outdoor_Playground_Experience_3.jpg"", ""original_url"": ""https://www.semec.com.sg/amk-park"", ""source_credit"": ""semec""}, {""local_path"": ""events_output/event_2/images/user_uploads/Ang_Mo_Kio_Park___An_Outdoor_Playground_Experience_4.jpg"", ""filename"": ""Ang_Mo_Kio_Park___An_Outdoor_Playground_Experience_4.jpg"", ""original_url"": ""https://www.semec.com.sg/amk-park"", ""source_credit"": ""semec""}, {""url"": ""https://static.wixstatic.com/media/a8e125_7e13d50edfdeb76711b74ed3cd5cc4cd.jpg/v1/fill/w_477,h_406,al_c,q_80,usm_0.66_1.00_0.01,enc_avif,quality_auto/a8e125_7e13d50edfdeb76711b74ed3cd5cc4cd.jpg"", ""source_credit"": ""SEMEC""}, {""url"": ""https://static.wixstatic.com/media/a8e125_67a98a04ed7549edb0dbdc1574e94994.jpg/v1/fill/w_473,h_406,al_c,q_80,usm_0.66_1.00_0.01,enc_avif,quality_auto/a8e125_67a98a04ed7549edb0dbdc1574e94994.jpg"", ""source_credit"": ""SEMEC""}]",103.8442614,1.3632348,TRUE,https://www.semec.com.sg/amk-park,Central Region,Bishan,Sandpit,"Slide, park, sand, swing, baby, toddler, merry-go-round"
107,Cck Park Outdoor Playground,SEMEC,Public playground with SEMEC equipment for kids.,"Cck Park features a public playground, providing a fun and engaging outdoor play experience for children of all ages. The playground offers a variety of play structures designed to promote physical activity and imaginative play in a safe and accessible environment. It's a great place for families to spend quality time together, encouraging kids to explore, climb, and socialize while enjoying the outdoors. The park is designed to be family-friendly, ensuring a pleasant experience for both children and their parents or guardians. The equipment is designed to be safe and durable.",https://www.semec.com.sg/parks,activity,https://www.semec.com.sg/parks,TRUE,Free,Free,0,0,0,1 to 12 years old,0,12,Available daily,Available daily,1970-01-01T00:00:00+08:00,2099-12-31T23:59:59+08:00,Cck Park,Choa Chu Kang Dr,Outdoor Playground,"[{""local_path"": ""events_output/event_3/images/user_uploads/Cck_Park_Outdoor_Playground_with_SEMEC_Equipment_1.jpg"", ""filename"": ""Cck_Park_Outdoor_Playground_with_SEMEC_Equipment_1.jpg"", ""original_url"": ""https://static.wixstatic.com/media/a8e125_296e590a7d05417daf7f3d697176145c.jpg"", ""source_credit"": ""semec""}, {""url"": ""https://static.wixstatic.com/media/a8e125_d468b8c668864186924e2b3b2bff211e.jpg/v1/fill/w_478,h_312,al_c,q_80,usm_0.66_1.00_0.01,enc_avif,quality_auto/a8e125_d468b8c668864186924e2b3b2bff211e.jpg"", ""source_credit"": ""SEMEC""}, {""url"": ""https://static.wixstatic.com/media/a8e125_73f5fd5c49aa43b4855502a019718ddf.jpg/v1/fill/w_472,h_312,al_c,q_80,usm_0.66_1.00_0.01,enc_avif,quality_auto/a8e125_73f5fd5c49aa43b4855502a019718ddf.jpg"", ""source_credit"": ""SEMEC""}]","[{""local_path"": ""events_output/event_3/images/user_uploads/Cck_Park_Outdoor_Playground_with_SEMEC_Equipment_1.jpg"", ""filename"": ""Cck_Park_Outdoor_Playground_with_SEMEC_Equipment_1.jpg"", ""original_url"": ""https://static.wixstatic.com/media/a8e125_296e590a7d05417daf7f3d697176145c.jpg"", ""source_credit"": ""semec""}, {""url"": ""https://static.wixstatic.com/media/a8e125_d468b8c668864186924e2b3b2bff211e.jpg/v1/fill/w_478,h_312,al_c,q_80,usm_0.66_1.00_0.01,enc_avif,quality_auto/a8e125_d468b8c668864186924e2b3b2bff211e.jpg"", ""source_credit"": ""SEMEC""}, {""url"": ""https://static.wixstatic.com/media/a8e125_73f5fd5c49aa43b4855502a019718ddf.jpg/v1/fill/w_472,h_312,al_c,q_80,usm_0.66_1.00_0.01,enc_avif,quality_auto/a8e125_73f5fd5c49aa43b4855502a019718ddf.jpg"", ""source_credit"": ""SEMEC""}]",103.7403691,1.3808895,TRUE,https://www.semec.com.sg/cck-park,West Region,Choa Chu Kang,Sandpit,"Slide, park, sand, swing, baby, toddler, merry-go-round"
