ID,title,organiser,blurb,description,guid,activity_or_event,url,is_free,price_display_teaser,price_display,price,min_price,max_price,age_group_display,min_age,max_age,datetime_display_teaser,datetime_display,start_datetime,end_datetime,venue_name,address_display,categories,images,images_replace_quotes,longitude,latitude,checked,_source_url,region,planning_area,Label tagging,Keyword tagging
33,Nature Playgarden at Admiralty Park Adventure,NParks,Hours of fun at a nature playgarden inspired by mangroves.,"The nature playgarden at Admiralty Park offers a thrilling experience for young ones with 26 slides and a variety of play equipment in the Junior Play, Adventure Play, and Family Play zones. Junior Play is suitable for children between 2 and 5 years old and includes slides, a sand play area, an expression swing, and an inclusive playground. Adventure Play is suitable for children of all ages and includes roller slides and swings. Family Play is suitable for older children between 5 and 12 years old and includes double barrel slides and a circuit descending roller ride. The playgarden is set in a hilly terrain.",https://www.nparks.gov.sg/visit/parks/admiralty-park/amenities/nature-playgarden,activity,https://www.nparks.gov.sg/visit/parks/admiralty-park/amenities/nature-playgarden,TRUE,Free,Free,0,0,0,2 to 12 years old,2,12,Available daily,Available daily,1970-01-01T00:00:00+08:00,2099-12-31T23:59:59+08:00,Admiralty Park,"Admiralty Park, 31 Riverside Rd, Singapore 730000",Outdoor Playground,"[{""local_path"": ""events_output/event_1/images/user_uploads/Nature_Playgarden_at_Admiralty_Park_Adventure_1.jpg"", ""filename"": ""Nature_Playgarden_at_Admiralty_Park_Adventure_1.jpg"", ""original_url"": ""https://www.nparks.gov.sg/visit/parks/admiralty-park/amenities/nature-playgarden"", ""source_credit"": ""nparks""}, {""local_path"": ""events_output/event_1/images/user_uploads/Nature_Playgarden_at_Admiralty_Park_Adventure_2.png"", ""filename"": ""Nature_Playgarden_at_Admiralty_Park_Adventure_2.png"", ""original_url"": ""https://www.nparks.gov.sg/visit/parks/admiralty-park/amenities/nature-playgarden"", ""source_credit"": ""nparks""}]","[{""local_path"": ""events_output/event_1/images/user_uploads/Nature_Playgarden_at_Admiralty_Park_Adventure_1.jpg"", ""filename"": ""Nature_Playgarden_at_Admiralty_Park_Adventure_1.jpg"", ""original_url"": ""https://www.nparks.gov.sg/visit/parks/admiralty-park/amenities/nature-playgarden"", ""source_credit"": ""nparks""}, {""local_path"": ""events_output/event_1/images/user_uploads/Nature_Playgarden_at_Admiralty_Park_Adventure_2.png"", ""filename"": ""Nature_Playgarden_at_Admiralty_Park_Adventure_2.png"", ""original_url"": ""https://www.nparks.gov.sg/visit/parks/admiralty-park/amenities/nature-playgarden"", ""source_credit"": ""nparks""}]",103.78087,1.44733,TRUE,,North Region,Woodlands,Sandpit,"Sand, Admiralty, Slide, Swing, Outdoor, Nature, Fun, Park"
34,Mandai Rainforest Resort Playground Experience,CT-Art Creation,Unique play spaces tailored to parks and destinations.,"Step into a world of creativity and imagination with customised playgrounds and attractions! From iconic landmarks to one-of-a-kind attractions, visions are brought to life with innovative, safe, and engaging designs. Perfect for families and children of all ages, these playgrounds offer a range of activities to stimulate creativity and physical activity. Parents can relax knowing their children are playing in a safe and well-designed environment. These attractions provide a memorable experience for the whole family.",https://ctart.com.sg/collections/attractions-customised-play,activity,https://ctart.com.sg/collections/attractions-customised-play,TRUE,Free,Free,0,0,0,2 to 12 years old,2,12,Available daily,Available daily,1970-01-01T00:00:00+08:00,2099-12-31T23:59:59+08:00,Mandai Rainforest Resort,"60 Mandai Lake Rd, Singapore 729979","Outdoor Playground, Attraction","[{""url"": ""https://ctart.com.sg/cdn/shop/files/project-mandai-rainforest-playground-gallery1.jpg?v=1743752190&width=1200"", ""source_credit"": ""CT-Art Creation""}, {""url"": ""https://ctart.com.sg/cdn/shop/files/project-mandai-rainforest-playground-gallery4.jpg?v=1743752199&width=1200"", ""source_credit"": ""CT-Art Creation""}]","[{""url"": ""https://ctart.com.sg/cdn/shop/files/project-mandai-rainforest-playground-gallery1.jpg?v=1743752190&width=1200"", ""source_credit"": ""CT-Art Creation""}, {""url"": ""https://ctart.com.sg/cdn/shop/files/project-mandai-rainforest-playground-gallery4.jpg?v=1743752199&width=1200"", ""source_credit"": ""CT-Art Creation""}]",103.7907476,1.4071032,TRUE,,North Region,Central Water Catchment,,"Slide, outdoor, rock-climbing, rainforest"
35,Mandai KidzWorld Playground and Attractions,CT-Art Creation,Unique play spaces tailored to parks and destinations.,"Mandai KidzWorld is a family-friendly playground designed to spark adventure, creativity, and sensory play. The Play Trees zone invites kids to climb, slide, bounce, and make music with nature-inspired instruments shaped like frogs and flowers, while the Splish Splash water play area cools things down with fountains, spouts, and tipping buckets for endless fun. Completed in 2024 and enhanced with wildlife touches like a Pangolin sculpture, the space blends physical challenges, sensory exploration, and imaginative design into a safe and exciting environment for play and bonding.",https://ctart.com.sg/collections/attractions-customised-play,activity,https://ctart.com.sg/collections/attractions-customised-play,TRUE,Free,Free (Zoo admission required),0,0,0,2 to 12 years old,2,12,Available daily,"Available daily, 8:30am - 6pm",1970-01-01T00:00:00+08:00,2099-12-31T23:59:59+08:00,Mandai KidzWorld,"80 Mandai Lake Rd, Singapore 729826","Outdoor Playground, Attraction","[{""local_path"": ""events_output/event_2/images/user_uploads/Mandai_KidzWorld_Playground_and_Attractions_1.webp"", ""filename"": ""Mandai_KidzWorld_Playground_and_Attractions_1.webp"", ""original_url"": ""https://ctart.com.sg/collections/attractions-customised-play/products/mandai-kidzworld"", ""source_credit"": ""ctart""}, {""local_path"": ""events_output/event_2/images/user_uploads/Mandai_KidzWorld_Playground_and_Attractions_2.webp"", ""filename"": ""Mandai_KidzWorld_Playground_and_Attractions_2.webp"", ""original_url"": ""https://ctart.com.sg/collections/attractions-customised-play/products/mandai-kidzworld"", ""source_credit"": ""ctart""}, {""local_path"": ""events_output/event_2/images/user_uploads/Mandai_KidzWorld_Playground_and_Attractions_3.webp"", ""filename"": ""Mandai_KidzWorld_Playground_and_Attractions_3.webp"", ""original_url"": ""https://ctart.com.sg/collections/attractions-customised-play/products/mandai-kidzworld"", ""source_credit"": ""ctart""}]","[{""local_path"": ""events_output/event_2/images/user_uploads/Mandai_KidzWorld_Playground_and_Attractions_1.webp"", ""filename"": ""Mandai_KidzWorld_Playground_and_Attractions_1.webp"", ""original_url"": ""https://ctart.com.sg/collections/attractions-customised-play/products/mandai-kidzworld"", ""source_credit"": ""ctart""}, {""local_path"": ""events_output/event_2/images/user_uploads/Mandai_KidzWorld_Playground_and_Attractions_2.webp"", ""filename"": ""Mandai_KidzWorld_Playground_and_Attractions_2.webp"", ""original_url"": ""https://ctart.com.sg/collections/attractions-customised-play/products/mandai-kidzworld"", ""source_credit"": ""ctart""}, {""local_path"": ""events_output/event_2/images/user_uploads/Mandai_KidzWorld_Playground_and_Attractions_3.webp"", ""filename"": ""Mandai_KidzWorld_Playground_and_Attractions_3.webp"", ""original_url"": ""https://ctart.com.sg/collections/attractions-customised-play/products/mandai-kidzworld"", ""source_credit"": ""ctart""}]",103.7906151,1.404589,TRUE,,North Region,Central Water Catchment,Water play,"Zoo, splash, slide, treehouse, trampoline, outdoor"
36,Bidadari Park Playground and Family Activities,CT-Art Creation,Unique play spaces tailored to parks and destinations.,"Bidadari Park’s Adventure Playwoods is a whimsical playground completed in 2024, that draws its inspiration from Winnie-the‐Pooh’s Hundred Acre Wood. Nestled within a birdwatcher’s haven, the design evokes the natural charm of a bird’s nest - through interwoven rope and wood structures - challenging young climbers’ balance and agility.  At the top, sleek stainless steel Atlantics slides offer exhilarating glides, while ziplines let children soar, embracing a sense of flight. This playground blends adventure, safety, and imagination in a nature-themed setting where families and children can explore, connect, and dream.",https://ctart.com.sg/collections/attractions-customised-play,activity,https://ctart.com.sg/collections/attractions-customised-play,TRUE,Free,Free,0,0,0,5 to 12 years old,5,12,Available daily,Available daily,1970-01-01T00:00:00+08:00,2099-12-31T23:59:59+08:00,Bidadari Park,"121 Upper Aljunied Rd, Singapore 367878",Outdoor Playground,"[{""local_path"": ""events_output/event_3/images/user_uploads/Bidadari_Park_Playground_and_Family_Activities_1.jpg"", ""filename"": ""Bidadari_Park_Playground_and_Family_Activities_1.jpg"", ""original_url"": ""https://ctart.com.sg/collections/attractions-customised-play/products/bidadari-park"", ""source_credit"": ""ctart""}, {""local_path"": ""events_output/event_3/images/user_uploads/Bidadari_Park_Playground_and_Family_Activities_2.webp"", ""filename"": ""Bidadari_Park_Playground_and_Family_Activities_2.webp"", ""original_url"": ""https://ctart.com.sg/collections/attractions-customised-play/products/bidadari-park"", ""source_credit"": ""ctart""}]","[{""local_path"": ""events_output/event_3/images/user_uploads/Bidadari_Park_Playground_and_Family_Activities_1.jpg"", ""filename"": ""Bidadari_Park_Playground_and_Family_Activities_1.jpg"", ""original_url"": ""https://ctart.com.sg/collections/attractions-customised-play/products/bidadari-park"", ""source_credit"": ""ctart""}, {""local_path"": ""events_output/event_3/images/user_uploads/Bidadari_Park_Playground_and_Family_Activities_2.webp"", ""filename"": ""Bidadari_Park_Playground_and_Family_Activities_2.webp"", ""original_url"": ""https://ctart.com.sg/collections/attractions-customised-play/products/bidadari-park"", ""source_credit"": ""ctart""}]",103.8749693,1.3395099,TRUE,,Central Region,Toa Payoh,Sandpit,"Sand, Bidadari, outdoor, slide, flying fox, nature, park, zipline"
37,Jurong Lake Gardens Playground and Attractions,CT-Art Creation,Unique play spaces tailored to parks and destinations.,"Jurong Lake Gardens’ - Forest Ramble is Singapore’s largest nature-inspired playground open since 2019. Drawing its theme from a freshwater swamp forest ecosystem, it features a variety of zones that bring swamp creatures to life through play. Kids can swing like butterflies, zipline like herons, and explore heron nests in the *Fluttering Butterflies* and *Heron Play* zones. There are balance-challenging spring platforms in *Squirrel Play*, imaginative hide-and-seek nooks like wooden crates and transparent spheres in *Crab Play*, log climbs and interactive water channels in *Otter Play*, and boundless bouncing fun in the *Frog Play* trampolines. Younger children get space in *Ant Play* to build with foam blocks, and everyone gets to tackle the *Adventure Bridge* and climb the iconic Snake Play wooden tower with multiple slides. Forest Ramble blends imagination, nature, and physical challenge into a playful escape in the midst of lush greenery.",https://ctart.com.sg/collections/attractions-customised-play,activity,https://ctart.com.sg/collections/attractions-customised-play,TRUE,Free,Free,0,0,0,5 to 12 years old,5,12,Available daily,Available daily,1970-01-01T00:00:00+08:00,2099-12-31T23:59:59+08:00,Jurong Lake Gardens,Yuan Ching Rd,Outdoor Playground,"[{""local_path"": ""events_output/event_4/images/user_uploads/Jurong_Lake_Gardens_Playground_and_Attractions_1.jpg"", ""filename"": ""Jurong_Lake_Gardens_Playground_and_Attractions_1.jpg"", ""original_url"": ""https://juronglakegardens.nparks.gov.sg/forest-ramble/"", ""source_credit"": ""juronglakegardens""}, {""local_path"": ""events_output/event_4/images/user_uploads/Jurong_Lake_Gardens_Playground_and_Attractions_2.webp"", ""filename"": ""Jurong_Lake_Gardens_Playground_and_Attractions_2.webp"", ""original_url"": ""https://ctart.com.sg/collections/attractions-customised-play/products/jurong-lake-gardens"", ""source_credit"": ""ctart""}, {""local_path"": ""events_output/event_4/images/user_uploads/Jurong_Lake_Gardens_Playground_and_Attractions_3.webp"", ""filename"": ""Jurong_Lake_Gardens_Playground_and_Attractions_3.webp"", ""original_url"": ""https://ctart.com.sg/collections/attractions-customised-play/products/jurong-lake-gardens"", ""source_credit"": ""ctart""}, {""local_path"": ""events_output/event_4/images/user_uploads/Jurong_Lake_Gardens_Playground_and_Attractions_4.jpg"", ""filename"": ""Jurong_Lake_Gardens_Playground_and_Attractions_4.jpg"", ""original_url"": ""https://ctart.com.sg/collections/attractions-customised-play/products/jurong-lake-gardens"", ""source_credit"": ""ctart""}, {""local_path"": ""events_output/event_4/images/user_uploads/Jurong_Lake_Gardens_Playground_and_Attractions_5.jpg"", ""filename"": ""Jurong_Lake_Gardens_Playground_and_Attractions_5.jpg"", ""original_url"": ""https://juronglakegardens.nparks.gov.sg/forest-ramble/"", ""source_credit"": ""juronglakegardens""}]","[{""local_path"": ""events_output/event_4/images/user_uploads/Jurong_Lake_Gardens_Playground_and_Attractions_1.jpg"", ""filename"": ""Jurong_Lake_Gardens_Playground_and_Attractions_1.jpg"", ""original_url"": ""https://juronglakegardens.nparks.gov.sg/forest-ramble/"", ""source_credit"": ""juronglakegardens""}, {""local_path"": ""events_output/event_4/images/user_uploads/Jurong_Lake_Gardens_Playground_and_Attractions_2.webp"", ""filename"": ""Jurong_Lake_Gardens_Playground_and_Attractions_2.webp"", ""original_url"": ""https://ctart.com.sg/collections/attractions-customised-play/products/jurong-lake-gardens"", ""source_credit"": ""ctart""}, {""local_path"": ""events_output/event_4/images/user_uploads/Jurong_Lake_Gardens_Playground_and_Attractions_3.webp"", ""filename"": ""Jurong_Lake_Gardens_Playground_and_Attractions_3.webp"", ""original_url"": ""https://ctart.com.sg/collections/attractions-customised-play/products/jurong-lake-gardens"", ""source_credit"": ""ctart""}, {""local_path"": ""events_output/event_4/images/user_uploads/Jurong_Lake_Gardens_Playground_and_Attractions_4.jpg"", ""filename"": ""Jurong_Lake_Gardens_Playground_and_Attractions_4.jpg"", ""original_url"": ""https://ctart.com.sg/collections/attractions-customised-play/products/jurong-lake-gardens"", ""source_credit"": ""ctart""}, {""local_path"": ""events_output/event_4/images/user_uploads/Jurong_Lake_Gardens_Playground_and_Attractions_5.jpg"", ""filename"": ""Jurong_Lake_Gardens_Playground_and_Attractions_5.jpg"", ""original_url"": ""https://juronglakegardens.nparks.gov.sg/forest-ramble/"", ""source_credit"": ""juronglakegardens""}]",103.7264557,1.3348492,TRUE,,West Region,Jurong East,Sandpit,"Sand, swing, nature, forest, zipline, flying fox, slide, Jurong lake, garden, park"
38,Tengah Garden Court Praying Mantis Playground,CT-Art Creation,Unique play spaces tailored to parks and destinations.,"Tengah Garden Court — Praying Mantis is a nature-inspired playground completed in 2024. Its centerpiece is a praying mantis-shaped structure linked via a roll glider to a leaf-shaped play area, giving kids climbing nets, a high slide, and adventurous pathways to explore. To extend the fun to the whole family, there’s also a Stilum fitness corner for adults. It blends wildlife theming with durable equipment to create a safe, active, and imaginative outdoor space.",https://ctart.com.sg/collections/attractions-customised-play,activity,https://ctart.com.sg/collections/attractions-customised-play,TRUE,Free,Free,0,0,0,5 to 12 years old,5,12,Available daily,Available daily,1970-01-01T00:00:00+08:00,2099-12-31T23:59:59+08:00,Tengah Garden Court,"221A Tengah Garden Walk, Singapore 691221",Outdoor Playground,"[{""local_path"": ""events_output/event_5/images/user_uploads/Tengah_Garden_Court_Praying_Mantis_Playground_1.webp"", ""filename"": ""Tengah_Garden_Court_Praying_Mantis_Playground_1.webp"", ""original_url"": ""https://ctart.com.sg/collections/attractions-customised-play/products/tengah-garden-court-praying-mantis"", ""source_credit"": ""ctart""}, {""local_path"": ""events_output/event_5/images/user_uploads/Tengah_Garden_Court_Praying_Mantis_Playground_2.webp"", ""filename"": ""Tengah_Garden_Court_Praying_Mantis_Playground_2.webp"", ""original_url"": ""https://ctart.com.sg/collections/attractions-customised-play/products/tengah-garden-court-praying-mantis"", ""source_credit"": ""ctart""}, {""local_path"": ""events_output/event_5/images/user_uploads/Tengah_Garden_Court_Praying_Mantis_Playground_3.webp"", ""filename"": ""Tengah_Garden_Court_Praying_Mantis_Playground_3.webp"", ""original_url"": ""https://ctart.com.sg/collections/attractions-customised-play/products/tengah-garden-court-praying-mantis"", ""source_credit"": ""ctart""}]","[{""local_path"": ""events_output/event_5/images/user_uploads/Tengah_Garden_Court_Praying_Mantis_Playground_1.webp"", ""filename"": ""Tengah_Garden_Court_Praying_Mantis_Playground_1.webp"", ""original_url"": ""https://ctart.com.sg/collections/attractions-customised-play/products/tengah-garden-court-praying-mantis"", ""source_credit"": ""ctart""}, {""local_path"": ""events_output/event_5/images/user_uploads/Tengah_Garden_Court_Praying_Mantis_Playground_2.webp"", ""filename"": ""Tengah_Garden_Court_Praying_Mantis_Playground_2.webp"", ""original_url"": ""https://ctart.com.sg/collections/attractions-customised-play/products/tengah-garden-court-praying-mantis"", ""source_credit"": ""ctart""}, {""local_path"": ""events_output/event_5/images/user_uploads/Tengah_Garden_Court_Praying_Mantis_Playground_3.webp"", ""filename"": ""Tengah_Garden_Court_Praying_Mantis_Playground_3.webp"", ""original_url"": ""https://ctart.com.sg/collections/attractions-customised-play/products/tengah-garden-court-praying-mantis"", ""source_credit"": ""ctart""}]",103.7293743,1.3581009,TRUE,,West Region,Tengah,,"Praying mantis, slide, zipline, flying fox, Tengah, neighborhood, insect, Neighbourhood"
39,Tengah Garden Court Ladybug Playground Fun,CT-Art Creation,Unique play spaces tailored to parks and destinations.,"At the heart of Ladybug Land lies a charming ladybug-themed playground. Its central structure includes varied climbing challenges — vertical ropes, cargo nets, and a rock wall — that invite little ones to test balance and build strength. Additional elements like PlayCubes for creative exploration, cozy Pods for relaxing, and a group swing for collaborative fun round out the children's offerings. Beyond play, adults are catered for with Galopin fitness equipment adjacent to the playground — making it a multigenerational space embedded in nature.",https://ctart.com.sg/collections/attractions-customised-play,activity,https://ctart.com.sg/collections/attractions-customised-play,TRUE,Free,Free,0,0,0,2 to 5 years old,2,5,Available daily,Available daily,1970-01-01T00:00:00+08:00,2099-12-31T23:59:59+08:00,Tengah Garden Court,"219 Tengah Garden Walk, Singapore 690219",Outdoor Playground,"[{""local_path"": ""events_output/event_6/images/user_uploads/Tengah_Garden_Court_Ladybug_Playground_Fun_1.webp"", ""filename"": ""Tengah_Garden_Court_Ladybug_Playground_Fun_1.webp"", ""original_url"": ""https://ctart.com.sg/collections/attractions-customised-play/products/tengah-garden-court-ladybug"", ""source_credit"": ""ctart""}, {""local_path"": ""events_output/event_6/images/user_uploads/Tengah_Garden_Court_Ladybug_Playground_Fun_2.webp"", ""filename"": ""Tengah_Garden_Court_Ladybug_Playground_Fun_2.webp"", ""original_url"": ""https://ctart.com.sg/collections/attractions-customised-play/products/tengah-garden-court-ladybug"", ""source_credit"": ""ctart""}, {""local_path"": ""events_output/event_6/images/user_uploads/Tengah_Garden_Court_Ladybug_Playground_Fun_3.webp"", ""filename"": ""Tengah_Garden_Court_Ladybug_Playground_Fun_3.webp"", ""original_url"": ""https://ctart.com.sg/collections/attractions-customised-play/products/tengah-garden-court-ladybug"", ""source_credit"": ""ctart""}]","[{""local_path"": ""events_output/event_6/images/user_uploads/Tengah_Garden_Court_Ladybug_Playground_Fun_1.webp"", ""filename"": ""Tengah_Garden_Court_Ladybug_Playground_Fun_1.webp"", ""original_url"": ""https://ctart.com.sg/collections/attractions-customised-play/products/tengah-garden-court-ladybug"", ""source_credit"": ""ctart""}, {""local_path"": ""events_output/event_6/images/user_uploads/Tengah_Garden_Court_Ladybug_Playground_Fun_2.webp"", ""filename"": ""Tengah_Garden_Court_Ladybug_Playground_Fun_2.webp"", ""original_url"": ""https://ctart.com.sg/collections/attractions-customised-play/products/tengah-garden-court-ladybug"", ""source_credit"": ""ctart""}, {""local_path"": ""events_output/event_6/images/user_uploads/Tengah_Garden_Court_Ladybug_Playground_Fun_3.webp"", ""filename"": ""Tengah_Garden_Court_Ladybug_Playground_Fun_3.webp"", ""original_url"": ""https://ctart.com.sg/collections/attractions-customised-play/products/tengah-garden-court-ladybug"", ""source_credit"": ""ctart""}]",103.731039,1.3590186,TRUE,,West Region,Tengah,,"ladybug, insect, slide, neighborhood, Tengah, Neighbourhood"
40,Keat Hong Verge Playground and Family Area,CT-Art Creation,Unique play spaces tailored to parks and destinations.,"Keat Hong Verge presents a nature-inspired playground completed in 2024. The design centres around a bird’s-nest theme with structures that encourage climbing, sliding, swinging, and imaginative play. Climbing features by Recreology sharpen motor skills; Galopin modules add nature motifs and active play; Stilum designs include a caterpillar‐shaped element and seesaw. Interactive panels from Playworld also bring educational play into the mix. Blending art, nature, and physical challenge, this playground transforms its green surroundings into an engaging and vibrant community space.",https://ctart.com.sg/collections/attractions-customised-play,activity,https://ctart.com.sg/collections/attractions-customised-play,TRUE,Free,Free,0,0,0,2 to 12 years old,2,12,Available daily,Available daily,1970-01-01T00:00:00+08:00,2099-12-31T23:59:59+08:00,Keat Hong Verge,"454 Choa Chu Kang Ave 4, Singapore 680454",Outdoor Playground,"[{""local_path"": ""events_output/event_7/images/user_uploads/Keat_Hong_Verge_Playground_and_Family_Area_1.jpg"", ""filename"": ""Keat_Hong_Verge_Playground_and_Family_Area_1.jpg"", ""original_url"": ""https://ctart.com.sg/collections/attractions-customised-play/products/keat-hong-verge"", ""source_credit"": ""ctart""}, {""local_path"": ""events_output/event_7/images/user_uploads/Keat_Hong_Verge_Playground_and_Family_Area_2.webp"", ""filename"": ""Keat_Hong_Verge_Playground_and_Family_Area_2.webp"", ""original_url"": ""https://ctart.com.sg/collections/attractions-customised-play/products/keat-hong-verge"", ""source_credit"": ""ctart""}, {""local_path"": ""events_output/event_7/images/user_uploads/Keat_Hong_Verge_Playground_and_Family_Area_3.webp"", ""filename"": ""Keat_Hong_Verge_Playground_and_Family_Area_3.webp"", ""original_url"": ""https://ctart.com.sg/collections/attractions-customised-play/products/keat-hong-verge"", ""source_credit"": ""ctart""}, {""local_path"": ""events_output/event_7/images/user_uploads/Keat_Hong_Verge_Playground_and_Family_Area_4.webp"", ""filename"": ""Keat_Hong_Verge_Playground_and_Family_Area_4.webp"", ""original_url"": ""https://ctart.com.sg/collections/attractions-customised-play/products/keat-hong-verge"", ""source_credit"": ""ctart""}]","[{""local_path"": ""events_output/event_7/images/user_uploads/Keat_Hong_Verge_Playground_and_Family_Area_1.jpg"", ""filename"": ""Keat_Hong_Verge_Playground_and_Family_Area_1.jpg"", ""original_url"": ""https://ctart.com.sg/collections/attractions-customised-play/products/keat-hong-verge"", ""source_credit"": ""ctart""}, {""local_path"": ""events_output/event_7/images/user_uploads/Keat_Hong_Verge_Playground_and_Family_Area_2.webp"", ""filename"": ""Keat_Hong_Verge_Playground_and_Family_Area_2.webp"", ""original_url"": ""https://ctart.com.sg/collections/attractions-customised-play/products/keat-hong-verge"", ""source_credit"": ""ctart""}, {""local_path"": ""events_output/event_7/images/user_uploads/Keat_Hong_Verge_Playground_and_Family_Area_3.webp"", ""filename"": ""Keat_Hong_Verge_Playground_and_Family_Area_3.webp"", ""original_url"": ""https://ctart.com.sg/collections/attractions-customised-play/products/keat-hong-verge"", ""source_credit"": ""ctart""}, {""local_path"": ""events_output/event_7/images/user_uploads/Keat_Hong_Verge_Playground_and_Family_Area_4.webp"", ""filename"": ""Keat_Hong_Verge_Playground_and_Family_Area_4.webp"", ""original_url"": ""https://ctart.com.sg/collections/attractions-customised-play/products/keat-hong-verge"", ""source_credit"": ""ctart""}]",103.7340209,1.3786822,TRUE,,West Region,Choa Chu Kang,,"Neighborhood, slide, toddler, Tengah, swing, Neighbourhood"
