ID,title,organiser,blurb,description,guid,activity_or_event,url,is_free,price_display_teaser,price_display,price,min_price,max_price,age_group_display,min_age,max_age,datetime_display_teaser,datetime_display,start_datetime,end_datetime,venue_name,address_display,categories,images,images_replace_quotes,longitude,latitude,checked,_source_url,region,planning_area,Label tagging,Keyword tagging
134,Choa Chu Kang Park Playground and Play Features,National Parks Board,Pyramid climbing net and train-themed play structures.,"Choa Chu Kang Park offers a variety of play areas suitable for children of different ages. Older children can enjoy the challenging pyramid climbing net, while younger ones can explore train-themed structures and other imaginative play features. The park provides a fun and engaging environment for kids to develop their psychomotor and social skills through active play. Families can spend quality time together in this green space, enjoying the fresh air and natural surroundings. The park is designed to encourage physical activity and creativity, making it a great destination for a family outing. With its diverse play options, Choa Chu Kang Park ensures that children have a memorable and enjoyable experience.",https://www.nparks.gov.sg/visit/activities/fun-children,activity,https://www.nparks.gov.sg/visit/activities/fun-children,TRUE,Free,Free,0,0,0,1 to 15 years old,0,15,Available daily,Available daily,1970-01-01T00:00:00+08:00,2099-12-31T23:59:59+08:00,Choa Chu Kang Park,"Choa Chu Kang Dr, Singapore 688845",Outdoor Playground,"[{""local_path"": ""events_output/event_1/images/user_uploads/Choa_Chu_Kang_Park_Playground_and_Play_Features_1.jpg"", ""filename"": ""Choa_Chu_Kang_Park_Playground_and_Play_Features_1.jpg"", ""original_url"": ""https://www.nparks.gov.sg/visit/parks/park-detail/choa-chu-kang-park/#what-to-do"", ""source_credit"": ""nparks""}]","[{""local_path"": ""events_output/event_1/images/user_uploads/Choa_Chu_Kang_Park_Playground_and_Play_Features_1.jpg"", ""filename"": ""Choa_Chu_Kang_Park_Playground_and_Play_Features_1.jpg"", ""original_url"": ""https://www.nparks.gov.sg/visit/parks/park-detail/choa-chu-kang-park/#what-to-do"", ""source_credit"": ""nparks""}]",103.74753,1.38857,TRUE,,West Region,Choa Chu Kang,,"Slide, park, sand, swing, baby, toddler, merry-go-round"
135,Labrador Nature Reserve Play Tower and Maze Fun,National Parks Board,Play tower with slides and a wooden slab maze.,"Labrador Nature Reserve and Nature Park offer outdoor fun for kids with a playground featuring a play tower with slides, climbing features, and a unique maze made of wooden slabs. The playground provides a safe and engaging environment for children to develop their physical and cognitive skills through active play and exploration. Families can enjoy the natural surroundings while the little ones have fun in the playground. The park offers a unique blend of natural beauty and recreational opportunities, making it a perfect destination for a family outing. With its diverse play options and scenic setting, Labrador Nature Reserve provides a memorable experience for both children and adults. The playground is designed to encourage physical activity and creativity, ensuring that children have a fun and enriching experience.",https://www.nparks.gov.sg/visit/activities/fun-children,activity,https://www.nparks.gov.sg/visit/activities/fun-children,TRUE,Free,Free,0,0,0,1 to 14 years old,0,14,Available daily,Available daily,1970-01-01T00:00:00+08:00,2099-12-31T23:59:59+08:00,Labrador Nature Reserve,Labrador Park MRT Station,Outdoor Playground,[],[],103.8028779,1.2722959,TRUE,,Central Region,Bukit Merah,Sandpit,"Slide, park, garden, butterfly, sand, nature, swing"
136,Aljunied Park Sand Playground and Climbing Fun,National Parks Board,Sand playground and climbing structures for kids.,"Aljunied Park offers a sand playground and climbing structures where children can explore and have fun. Families can relax in the shade of the pavilion while the little ones enjoy the play area. The playground provides a safe and engaging environment for kids to develop their physical and social skills through active play. The park offers a unique blend of natural beauty and recreational opportunities, making it a perfect destination for a family outing. With its convenient location and picturesque setting, Aljunied Park provides a memorable experience for both children and adults. The playground is designed to encourage physical activity and exploration, ensuring that children have a fun and enriching experience.",https://www.nparks.gov.sg/visit/activities/fun-children,activity,https://www.nparks.gov.sg/visit/activities/fun-children,TRUE,Free,Free,0,0,0,1 to 12 years old,0,12,Available daily,Available daily,1970-01-01T00:00:00+08:00,2099-12-31T23:59:59+08:00,Aljunied Park,"Aljunied Road, Happy Garden Estate, Singapore 389842",Outdoor Playground,"[{""local_path"": ""events_output/event_3/images/user_uploads/Aljunied_Park_Sand_Playground_and_Climbing_Fun_1.jpg"", ""filename"": ""Aljunied_Park_Sand_Playground_and_Climbing_Fun_1.jpg"", ""original_url"": ""https://www.nparks.gov.sg/visit/parks/park-detail/aljunied-park/#what-to-do"", ""source_credit"": ""nparks""}, {""local_path"": ""events_output/event_3/images/user_uploads/Aljunied_Park_Sand_Playground_and_Climbing_Fun_2.jpg"", ""filename"": ""Aljunied_Park_Sand_Playground_and_Climbing_Fun_2.jpg"", ""original_url"": ""https://www.nparks.gov.sg/visit/parks/park-detail/aljunied-park/#what-to-do"", ""source_credit"": ""nparks""}]","[{""local_path"": ""events_output/event_3/images/user_uploads/Aljunied_Park_Sand_Playground_and_Climbing_Fun_1.jpg"", ""filename"": ""Aljunied_Park_Sand_Playground_and_Climbing_Fun_1.jpg"", ""original_url"": ""https://www.nparks.gov.sg/visit/parks/park-detail/aljunied-park/#what-to-do"", ""source_credit"": ""nparks""}, {""local_path"": ""events_output/event_3/images/user_uploads/Aljunied_Park_Sand_Playground_and_Climbing_Fun_2.jpg"", ""filename"": ""Aljunied_Park_Sand_Playground_and_Climbing_Fun_2.jpg"", ""original_url"": ""https://www.nparks.gov.sg/visit/parks/park-detail/aljunied-park/#what-to-do"", ""source_credit"": ""nparks""}]",103.8797014,1.3294577,TRUE,,Central Region,Geylang,Sandpit,"Slide, park, sand, swing"
137,Bukit Batok Nature Park Slides and Sand Play Area,National Parks Board,Colorful slides and sand play equipment for kids.,"Bukit Batok Nature Park offers a playground where young ones can explore colorful slides and play equipment, or enjoy sand play. The playground provides a safe and engaging environment for kids to develop their physical and social skills through active play. Families can relax and enjoy the natural surroundings while the little ones have fun in the playground. The park offers a unique blend of natural beauty and recreational opportunities, making it a perfect destination for a family outing. With its convenient location and picturesque setting, Bukit Batok Nature Park provides a memorable experience for both children and adults. The playground is designed to encourage physical activity and exploration, ensuring that children have a fun and enriching experience.",https://www.nparks.gov.sg/visit/activities/fun-children,activity,https://www.nparks.gov.sg/visit/activities/fun-children,TRUE,Free,Free,0,0,0,1 to 12 years old,0,12,Available daily,Available daily,1970-01-01T00:00:00+08:00,2099-12-31T23:59:59+08:00,Bukit Batok Nature Park,Bukit Batok West Ave 6,Outdoor Playground,[],[],103.7459284,1.348018,TRUE,,West Region,Bukit Batok,,"Slide, park, nature"
138,Yishun Park Playgrounds Amidst Nature Paths,National Parks Board,Playgrounds of different types spread across the park.,"Yishun Park offers playgrounds of different types spread across the park, where young ones can have fun and explore paths amid nature. The playgrounds provide a safe and engaging environment for kids to develop their physical and social skills through active play. Families can relax and enjoy the natural surroundings while the little ones have fun in the playground. The park offers a unique blend of natural beauty and recreational opportunities, making it a perfect destination for a family outing. With its diverse play options and scenic setting, Yishun Park provides a memorable experience for both children and adults. The playgrounds are designed to encourage physical activity and exploration, ensuring that children have a fun and enriching experience.",https://www.nparks.gov.sg/visit/activities/fun-children,activity,https://www.nparks.gov.sg/visit/activities/fun-children,TRUE,Free,Free,0,0,0,1 to 12 years old,0,12,Available daily,Available daily,1970-01-01T00:00:00+08:00,2099-12-31T23:59:59+08:00,Yishun Park,329 Yishun Ring Rd,Outdoor Playground,[],[],103.8430548,1.4317269,TRUE,,North Region,Yishun,Sandpit,"Slide, park, sand, nature"
139,Pasir Ris Park Rope Climbing and Flying Fox Fun,National Parks Board,"Rope climbing structures, slides, swings, flying fox.","Pasir Ris Park offers a variety of play equipment such as rope climbing structures, slides, swings, and a flying fox. The playground provides a safe and engaging environment for children to develop their physical and social skills through active play. Families can relax and enjoy the natural surroundings while the little ones have fun in the playground. The park offers a unique blend of natural beauty and recreational opportunities, making it a perfect destination for a family outing. With its diverse play options and scenic setting, Pasir Ris Park provides a memorable experience for both children and adults. The playground is designed to encourage physical activity and exploration, ensuring that children have a fun and enriching experience.",https://www.nparks.gov.sg/visit/activities/fun-children,activity,https://www.nparks.gov.sg/visit/activities/fun-children,TRUE,Free,Free,0,0,0,1 to 12 years old,0,12,Available daily,Available daily,1970-01-01T00:00:00+08:00,2099-12-31T23:59:59+08:00,Pasir Ris Park,"110 Pasir Ris Rd, Singapore 519113",Outdoor Playground,[],[],103.9448345,1.3835534,TRUE,,East Region,Pasir Ris,Sandpit,"Slide, park, sand, flying fox, zipline"
140,National Orchid Garden at the Botanic Gardens,National Parks Board,Introduce your family to Singapore's national flower.,"Visit the National Orchid Garden at the Botanic Gardens and introduce your family to the history of Vanda Miss Joaquim, our national flower. Explore the vibrant displays of orchids from around the world, learn about their unique characteristics, and discover the fascinating story behind Singapore's national flower. The garden offers a serene and educational experience for families, with interactive exhibits and guided tours available. Perfect for families who appreciate natural beauty and want to learn more about the diverse world of orchids. Enjoy a leisurely stroll through the garden and immerse yourselves in the sights and scents of these exquisite flowers.",https://www.nparks.gov.sg/visit/activities/fun-children,activity,https://www.nparks.gov.sg/visit/activities/fun-children,TRUE,Free + Paid options,$1 - $15 for adults (Free for child below 12),0,0,15,Suitable for all ages,0,99,Available daily,"Available daily, 8:30am - 7:00pm",1970-01-01T00:00:00+08:00,2099-12-31T23:59:59+08:00,National Orchid Garden,"1 Cluny Rd, Singapore 259569",Attraction,"[{""local_path"": ""events_output/event_7/images/user_uploads/National_Orchid_Garden_at_the_Botanic_Gardens_1.jpg"", ""filename"": ""National_Orchid_Garden_at_the_Botanic_Gardens_1.jpg"", ""original_url"": ""https://www.nparks.gov.sg/sbg/our-gardens/tyersall-entrance/national-orchid-garden"", ""source_credit"": ""nparks""}, {""local_path"": ""events_output/event_7/images/user_uploads/National_Orchid_Garden_at_the_Botanic_Gardens_2.jpg"", ""filename"": ""National_Orchid_Garden_at_the_Botanic_Gardens_2.jpg"", ""original_url"": ""https://www.nparks.gov.sg/sbg/our-gardens/tyersall-entrance/national-orchid-garden"", ""source_credit"": ""nparks""}, {""local_path"": ""events_output/event_7/images/user_uploads/National_Orchid_Garden_at_the_Botanic_Gardens_3.jpg"", ""filename"": ""National_Orchid_Garden_at_the_Botanic_Gardens_3.jpg"", ""original_url"": ""https://www.nparks.gov.sg/sbg/our-gardens/tyersall-entrance/national-orchid-garden"", ""source_credit"": ""nparks""}, {""local_path"": ""events_output/event_7/images/user_uploads/National_Orchid_Garden_at_the_Botanic_Gardens_4.jpg"", ""filename"": ""National_Orchid_Garden_at_the_Botanic_Gardens_4.jpg"", ""original_url"": ""https://www.nparks.gov.sg/sbg/our-gardens/tyersall-entrance/national-orchid-garden"", ""source_credit"": ""nparks""}]","[{""local_path"": ""events_output/event_7/images/user_uploads/National_Orchid_Garden_at_the_Botanic_Gardens_1.jpg"", ""filename"": ""National_Orchid_Garden_at_the_Botanic_Gardens_1.jpg"", ""original_url"": ""https://www.nparks.gov.sg/sbg/our-gardens/tyersall-entrance/national-orchid-garden"", ""source_credit"": ""nparks""}, {""local_path"": ""events_output/event_7/images/user_uploads/National_Orchid_Garden_at_the_Botanic_Gardens_2.jpg"", ""filename"": ""National_Orchid_Garden_at_the_Botanic_Gardens_2.jpg"", ""original_url"": ""https://www.nparks.gov.sg/sbg/our-gardens/tyersall-entrance/national-orchid-garden"", ""source_credit"": ""nparks""}, {""local_path"": ""events_output/event_7/images/user_uploads/National_Orchid_Garden_at_the_Botanic_Gardens_3.jpg"", ""filename"": ""National_Orchid_Garden_at_the_Botanic_Gardens_3.jpg"", ""original_url"": ""https://www.nparks.gov.sg/sbg/our-gardens/tyersall-entrance/national-orchid-garden"", ""source_credit"": ""nparks""}, {""local_path"": ""events_output/event_7/images/user_uploads/National_Orchid_Garden_at_the_Botanic_Gardens_4.jpg"", ""filename"": ""National_Orchid_Garden_at_the_Botanic_Gardens_4.jpg"", ""original_url"": ""https://www.nparks.gov.sg/sbg/our-gardens/tyersall-entrance/national-orchid-garden"", ""source_credit"": ""nparks""}]",103.814859,1.3116238,TRUE,,Central Region,Tanglin,,
141,CSC @ Changi II Playground and Water Play Area,CSC Changi,Enjoy playground and water play at CSC @ Changi II.,"CSC @ Changi II features recreational facilities, including a playground and water play area for children. The playground offers climbing frames, slides, and swings, providing a safe and stimulating environment for kids to play and explore. The water play area offers a refreshing escape from the heat, with interactive water features and shallow pools suitable for young children. Families can enjoy a day of fun and relaxation at CSC @ Changi II, with amenities such as restrooms and shaded seating areas available for their convenience. It's an ideal spot for family outings and children's activities.",https://www.cscchangi.sg/Fun_Playground.aspx,activity,https://www.cscchangi.sg/Fun_Playground.aspx,TRUE,Free,Free upon staying at facility,0,0,0,14 years old and below,0,14,Available daily,Available daily upon staying,1970-01-01T00:00:00+08:00,2099-12-31T23:59:59+08:00,CSC @ Changi II,"2 Netheravon Rd, Singapore 508503",Outdoor Playground,"[{""local_path"": ""events_output/event_3/images/user_uploads/CSC___Changi_II_Playground_and_Water_Play_Area_1.png"", ""filename"": ""CSC___Changi_II_Playground_and_Water_Play_Area_1.png"", ""original_url"": ""https://www.cscchangi.sg/Fun_Playground.aspx"", ""source_credit"": ""cscchangi""}, {""local_path"": ""events_output/event_3/images/user_uploads/CSC___Changi_II_Playground_and_Water_Play_Area_2.png"", ""filename"": ""CSC___Changi_II_Playground_and_Water_Play_Area_2.png"", ""original_url"": ""https://www.cscchangi.sg/Fun_Playground.aspx"", ""source_credit"": ""cscchangi""}, {""local_path"": ""events_output/event_3/images/user_uploads/CSC___Changi_II_Playground_and_Water_Play_Area_3.png"", ""filename"": ""CSC___Changi_II_Playground_and_Water_Play_Area_3.png"", ""original_url"": ""https://www.cscchangi.sg/Fun_Playground.aspx"", ""source_credit"": ""cscchangi""}, {""local_path"": ""events_output/event_3/images/user_uploads/CSC___Changi_II_Playground_and_Water_Play_Area_4.png"", ""filename"": ""CSC___Changi_II_Playground_and_Water_Play_Area_4.png"", ""original_url"": ""https://www.cscchangi.sg/Fun_Playground.aspx"", ""source_credit"": ""cscchangi""}]","[{""local_path"": ""events_output/event_3/images/user_uploads/CSC___Changi_II_Playground_and_Water_Play_Area_1.png"", ""filename"": ""CSC___Changi_II_Playground_and_Water_Play_Area_1.png"", ""original_url"": ""https://www.cscchangi.sg/Fun_Playground.aspx"", ""source_credit"": ""cscchangi""}, {""local_path"": ""events_output/event_3/images/user_uploads/CSC___Changi_II_Playground_and_Water_Play_Area_2.png"", ""filename"": ""CSC___Changi_II_Playground_and_Water_Play_Area_2.png"", ""original_url"": ""https://www.cscchangi.sg/Fun_Playground.aspx"", ""source_credit"": ""cscchangi""}, {""local_path"": ""events_output/event_3/images/user_uploads/CSC___Changi_II_Playground_and_Water_Play_Area_3.png"", ""filename"": ""CSC___Changi_II_Playground_and_Water_Play_Area_3.png"", ""original_url"": ""https://www.cscchangi.sg/Fun_Playground.aspx"", ""source_credit"": ""cscchangi""}, {""local_path"": ""events_output/event_3/images/user_uploads/CSC___Changi_II_Playground_and_Water_Play_Area_4.png"", ""filename"": ""CSC___Changi_II_Playground_and_Water_Play_Area_4.png"", ""original_url"": ""https://www.cscchangi.sg/Fun_Playground.aspx"", ""source_credit"": ""cscchangi""}]",103.9862467,1.3914147,TRUE,,East Region,Changi,Water play,"Slide, Water, see-saw"
142,Mandai Wildlife West - Recreational Fun for Kids,SEMEC,Enjoy outdoor play with SEMEC equipment at Public Playground.,"A public playground equipped with recreational equipment, designed to provide a safe and engaging environment for children to play and develop their physical skills. The playground features various play structures suitable for different age groups, promoting active play and social interaction in a community setting. It's a great place for families to spend quality time outdoors, encouraging kids to explore, climb, and have fun in a secure environment. The playground is open to the public and offers a range of activities to keep children entertained and active.",https://www.semec.com.sg/recreational-spaces,activity,https://www.semec.com.sg/recreational-spaces,TRUE,Free,Free,0,0,0,1 to 12 years old,0,12,Available daily,Available daily,1970-01-01T00:00:00+08:00,2099-12-31T23:59:59+08:00,Mandai Wildlife West,"20 Mandai Lake Rd, Singapore 729825",Outdoor Playground,"[{""local_path"": ""events_output/event_1/images/user_uploads/Mandai_Wildlife_West___Recreational_Fun_for_Kids_1.jpg"", ""filename"": ""Mandai_Wildlife_West___Recreational_Fun_for_Kids_1.jpg"", ""original_url"": ""https://www.semec.com.sg/mandaiwildlifewest"", ""source_credit"": ""semec""}, {""local_path"": ""events_output/event_1/images/user_uploads/Mandai_Wildlife_West___Recreational_Fun_for_Kids_2.jpg"", ""filename"": ""Mandai_Wildlife_West___Recreational_Fun_for_Kids_2.jpg"", ""original_url"": ""https://www.semec.com.sg/mandaiwildlifewest"", ""source_credit"": ""semec""}, {""local_path"": ""events_output/event_1/images/user_uploads/Mandai_Wildlife_West___Recreational_Fun_for_Kids_3.jpg"", ""filename"": ""Mandai_Wildlife_West___Recreational_Fun_for_Kids_3.jpg"", ""original_url"": ""https://www.semec.com.sg/mandaiwildlifewest"", ""source_credit"": ""semec""}, {""url"": ""https://static.wixstatic.com/media/a8e125_e22497c94d7b4a86b08a6e8d163807a0~mv2.jpg/v1/fill/w_2000,h_2000,q_100,enc_avif,quality_auto/a8e125_e22497c94d7b4a86b08a6e8d163807a0~mv2.jpg"", ""source_credit"": ""SEMEC""}]","[{""local_path"": ""events_output/event_1/images/user_uploads/Mandai_Wildlife_West___Recreational_Fun_for_Kids_1.jpg"", ""filename"": ""Mandai_Wildlife_West___Recreational_Fun_for_Kids_1.jpg"", ""original_url"": ""https://www.semec.com.sg/mandaiwildlifewest"", ""source_credit"": ""semec""}, {""local_path"": ""events_output/event_1/images/user_uploads/Mandai_Wildlife_West___Recreational_Fun_for_Kids_2.jpg"", ""filename"": ""Mandai_Wildlife_West___Recreational_Fun_for_Kids_2.jpg"", ""original_url"": ""https://www.semec.com.sg/mandaiwildlifewest"", ""source_credit"": ""semec""}, {""local_path"": ""events_output/event_1/images/user_uploads/Mandai_Wildlife_West___Recreational_Fun_for_Kids_3.jpg"", ""filename"": ""Mandai_Wildlife_West___Recreational_Fun_for_Kids_3.jpg"", ""original_url"": ""https://www.semec.com.sg/mandaiwildlifewest"", ""source_credit"": ""semec""}, {""url"": ""https://static.wixstatic.com/media/a8e125_e22497c94d7b4a86b08a6e8d163807a0~mv2.jpg/v1/fill/w_2000,h_2000,q_100,enc_avif,quality_auto/a8e125_e22497c94d7b4a86b08a6e8d163807a0~mv2.jpg"", ""source_credit"": ""SEMEC""}]",103.7804473,1.408012,TRUE,,North Region,Central Water Catchment,,"Slide, zoo"
143,City Square Mall Recreational Spaces,SEMEC,Outdoor playground with SEMEC equipment.,"This public playground features a variety of equipment suitable for children of various ages. It offers a safe and engaging environment for kids to play and develop their physical skills. The playground is designed to encourage social interaction and imaginative play, making it a great place for families to spend quality time together. Parents can relax while their children explore the different play structures and enjoy the outdoors. The playground is open to the public and provides a fun and accessible recreational space for the community. It is designed with safety in mind, ensuring a secure environment for children to play and explore.",https://www.semec.com.sg/recreational-spaces,activity,https://www.semec.com.sg/recreational-spaces,TRUE,Free,Free,0,0,0,1 to 12 years old,0,12,Available daily,Available daily,1970-01-01T00:00:00+08:00,2099-12-31T23:59:59+08:00,City Sqaure Mall,"180 Kitchener Road, Mall, #02-19A City Square, Singapore 208539",Outdoor Playground,"[{""local_path"": ""events_output/event_2/images/user_uploads/City_Square_Mall_Recreational_Spaces_1.jpg"", ""filename"": ""City_Square_Mall_Recreational_Spaces_1.jpg"", ""original_url"": ""https://static.wixstatic.com/media/a8e125_4247c7967a82448197a088e2f15b064c~mv2_d_4896_3264_s_4_2.jpg"", ""source_credit"": ""semec""}, {""url"": ""https://static.wixstatic.com/media/a8e125_87d9e48b56e94eccb65761f7c92d3494~mv2_d_4896_3264_s_4_2.jpg/v1/fill/w_2000,h_2000,q_100,enc_avif,quality_auto/a8e125_87d9e48b56e94eccb65761f7c92d3494~mv2_d_4896_3264_s_4_2.jpg"", ""source_credit"": ""SEMEC""}]","[{""local_path"": ""events_output/event_2/images/user_uploads/City_Square_Mall_Recreational_Spaces_1.jpg"", ""filename"": ""City_Square_Mall_Recreational_Spaces_1.jpg"", ""original_url"": ""https://static.wixstatic.com/media/a8e125_4247c7967a82448197a088e2f15b064c~mv2_d_4896_3264_s_4_2.jpg"", ""source_credit"": ""semec""}, {""url"": ""https://static.wixstatic.com/media/a8e125_87d9e48b56e94eccb65761f7c92d3494~mv2_d_4896_3264_s_4_2.jpg/v1/fill/w_2000,h_2000,q_100,enc_avif,quality_auto/a8e125_87d9e48b56e94eccb65761f7c92d3494~mv2_d_4896_3264_s_4_2.jpg"", ""source_credit"": ""SEMEC""}]",103.8565897,1.3113982,TRUE,,Central Region,Kallang,,"Slide, neighborhood, neighbourhood, merry-go-round, swing, see-saw"
144,Nestopia,SEMEC,Public playground with SEMEC equipment.,"This public playground features a variety of play equipment designed for children of various ages. It offers a safe and engaging environment for kids to develop their physical and social skills through active play. The playground includes swings, slides, climbing structures, and other interactive elements that promote creativity and exploration. It is a great place for families to spend quality time together, encouraging children to stay active and enjoy the outdoors. The playground is designed to be inclusive and accessible, catering to children of different abilities. Parents can relax knowing their children are playing in a secure and well-maintained space.",https://www.semec.com.sg/recreational-spaces,activity,https://www.semec.com.sg/recreational-spaces,FALSE,$12,$12 (1 hour),12,12,12,2 years old and above,2,99,Available daily (except Mon - Tue),"Wed - Fri: 2pm - 6.45pm Sat, Sun, PH & Local school holidays: 10am - 7pm",1970-01-01T00:00:00+08:00,2099-12-31T23:59:59+08:00,Nestopia ,"6 Siloso Bch Walk, 098995",Outdoor Playground,"[{""local_path"": ""events_output/event_3/images/user_uploads/Nestopia_1.jpg"", ""filename"": ""Nestopia_1.jpg"", ""original_url"": ""https://www.semec.com.sg/nestopia"", ""source_credit"": ""semec""}, {""local_path"": ""events_output/event_3/images/user_uploads/Nestopia_2.jpg"", ""filename"": ""Nestopia_2.jpg"", ""original_url"": ""https://www.semec.com.sg/nestopia"", ""source_credit"": ""semec""}, {""url"": ""https://static.wixstatic.com/media/a8e125_1d2406e4cf7345c1828679641be015db~mv2_d_4032_2526_s_4_2.jpg/v1/fill/w_2000,h_2000,q_100,enc_avif,quality_auto/a8e125_1d2406e4cf7345c1828679641be015db~mv2_d_4032_2526_s_4_2.jpg"", ""source_credit"": ""SEMEC""}]","[{""local_path"": ""events_output/event_3/images/user_uploads/Nestopia_1.jpg"", ""filename"": ""Nestopia_1.jpg"", ""original_url"": ""https://www.semec.com.sg/nestopia"", ""source_credit"": ""semec""}, {""local_path"": ""events_output/event_3/images/user_uploads/Nestopia_2.jpg"", ""filename"": ""Nestopia_2.jpg"", ""original_url"": ""https://www.semec.com.sg/nestopia"", ""source_credit"": ""semec""}, {""url"": ""https://static.wixstatic.com/media/a8e125_1d2406e4cf7345c1828679641be015db~mv2_d_4032_2526_s_4_2.jpg/v1/fill/w_2000,h_2000,q_100,enc_avif,quality_auto/a8e125_1d2406e4cf7345c1828679641be015db~mv2_d_4032_2526_s_4_2.jpg"", ""source_credit"": ""SEMEC""}]",103.811629,1.2565082,TRUE,,Central Region,Southern Islands,,"Slide, tall, sentosa, large"
